[
    {
        "internalName": "cf.cplace.risk",
        "localizedNameSingular": {
            "en": "Risk",
            "de": "Risiko"
        },
        "localizedNamePlural": {
            "en": "Risks",
            "de": "Risiken"
        },
        "iconName": "fa-exclamation-triangle"
    },
    {
        "internalName": "cf.cplace.mitigationAction",
        "localizedNameSingular": {
            "en": "Mitigation Action",
            "de": "Gegenma\u00dfnahme"
        },
        "localizedNamePlural": {
            "en": "Mitigation Actions",
            "de": "Gegenma\u00dfnahmen"
        },
        "iconName": "fa-tools"
    }
]