[
    {
        "internalName": "cf.cplace.cycle",
        "localizedNameSingular": {
            "en": "Cycle",
            "de": "Zyklus"
        },
        "localizedNamePlural": {
            "en": "Cycles",
            "de": "Zyklen"
        },
        "iconName": "fa-redo",
        "attributes": [
            {
                "internalName": "cf.cplace.cycle.name",
                "localizedName": {
                    "en": "Name",
                    "de": "Name"
                },
                "shortHelp": {
                    "en": "Name of the cycle",
                    "de": "Name des Zyklus"
                },
                "constraint": {
                    "attributeType": "string"
                },
                "multiplicity": "exactlyOne"
            },
            {
                "internalName": "cf.cplace.cycle.startDate",
                "localizedName": {
                    "en": "Start Date",
                    "de": "Startdatum"
                },
                "shortHelp": {
                    "en": "Start date of the cycle",
                    "de": "Startdatum des Zyklus"
                },
                "constraint": {
                    "attributeType": "date",
                    "specificity": "DAY",
                    "dateFormat": "DAY_YEAR_LONG"
                },
                "multiplicity": "exactlyOne"
            },
            {
                "internalName": "cf.cplace.cycle.endDate",
                "localizedName": {
                    "en": "End Date",
                    "de": "Enddatum"
                },
                "shortHelp": {
                    "en": "End date of the cycle",
                    "de": "Enddatum des Zyklus"
                },
                "constraint": {
                    "attributeType": "date",
                    "specificity": "DAY",
                    "dateFormat": "DAY_YEAR_LONG"
                },
                "multiplicity": "exactlyOne"
            }
        ]
    },
    {
        "internalName": "cf.cplace.objective",
        "localizedNameSingular": {
            "en": "Objective",
            "de": "Ziel"
        },
        "localizedNamePlural": {
            "en": "Objectives",
            "de": "Ziele"
        },
        "iconName": "fa-bullseye",
        "attributes": [
            {
                "internalName": "cf.cplace.objective.title",
                "localizedName": {
                    "en": "Title",
                    "de": "Titel"
                },
                "shortHelp": {
                    "en": "Title (required) for the objective",
                    "de": "Titel (erforderlich) f\u00fcr das Ziel"
                },
                "constraint": {
                    "attributeType": "string"
                },
                "multiplicity": "exactlyOne"
            },
            {
                "internalName": "cf.cplace.objective.description",
                "localizedName": {
                    "en": "Description",
                    "de": "Beschreibung"
                },
                "shortHelp": {
                    "en": "Detailed description of the objective",
                    "de": "Detaillierte Beschreibung der Zielsetzung"
                },
                "constraint": {
                    "attributeType": "string"
                },
                "multiplicity": "maximalOne"
            },
            {
                "internalName": "cf.cplace.objective.cycle",
                "localizedName": {
                    "en": "Cycle",
                    "de": "Zyklus"
                },
                "shortHelp": {
                    "en": "The cycle during which this objective is pursued",
                    "de": "Der Zyklus, in dem dieses Ziel verfolgt wird"
                },
                "constraint": {
                    "attributeType": "reference",
                    "targetEntityClass": "cf.cplace.platform.assets.file.Page",
                    "targetInternalTypeNames": "cf.cplace.cycle",
                    "isHierarchy": false
                },
                "multiplicity": "exactlyOne"
            }
        ]
    },
    {
        "internalName": "cf.cplace.keyResult",
        "localizedNameSingular": {
            "en": "Key Result",
            "de": "Schl\u00fcsselresultat"
        },
        "localizedNamePlural": {
            "en": "Key Results",
            "de": "Schl\u00fcsselresultate"
        },
        "iconName": "fa-chart-line",
        "attributes": [
            {
                "internalName": "cf.cplace.keyResult.title",
                "localizedName": {
                    "en": "Title",
                    "de": "Titel"
                },
                "shortHelp": {
                    "en": "Title of the key result",
                    "de": "Titel des Schl\u00fcsselergebnisses"
                },
                "constraint": {
                    "attributeType": "string"
                },
                "multiplicity": "exactlyOne"
            },
            {
                "internalName": "cf.cplace.keyResult.description",
                "localizedName": {
                    "en": "Description",
                    "de": "Beschreibung"
                },
                "shortHelp": {
                    "en": "Detailed description of the key result",
                    "de": "Detaillierte Beschreibung des Schl\u00fcsselergebnisses"
                },
                "constraint": {
                    "attributeType": "string"
                },
                "multiplicity": "maximalOne"
            },
            {
                "internalName": "cf.cplace.keyResult.objective",
                "localizedName": {
                    "en": "Objective",
                    "de": "Ziel"
                },
                "shortHelp": {
                    "en": "The objective to which this key result belongs",
                    "de": "Das Ziel, zu dem dieses Schl\u00fcsselergebnis geh\u00f6rt"
                },
                "constraint": {
                    "attributeType": "reference",
                    "targetEntityClass": "cf.cplace.platform.assets.file.Page",
                    "targetInternalTypeNames": "cf.cplace.objective",
                    "isHierarchy": false
                },
                "multiplicity": "exactlyOne"
            },
            {
                "internalName": "cf.cplace.keyResult.currentValue",
                "localizedName": {
                    "en": "Current Value",
                    "de": "Aktueller Wert"
                },
                "shortHelp": {
                    "en": "Current value of this key result",
                    "de": "Aktueller Wert dieses Schl\u00fcsselergebnisses"
                },
                "constraint": {
                    "attributeType": "number",
                    "precision": "0",
                    "localizedTextAfterSupplier": {
                        "en": "",
                        "de": ""
                    }
                },
                "multiplicity": "exactlyOne"
            },
            {
                "internalName": "cf.cplace.keyResult.targetValue",
                "localizedName": {
                    "en": "Target Value",
                    "de": "Zielwert"
                },
                "shortHelp": {
                    "en": "Target value of this key result",
                    "de": "Zielwert dieses Schl\u00fcsselergebnisses"
                },
                "constraint": {
                    "attributeType": "number",
                    "precision": "0",
                    "localizedTextAfterSupplier": {
                        "en": "",
                        "de": ""
                    }
                },
                "multiplicity": "exactlyOne"
            },
            {
                "internalName": "cf.cplace.keyResult.startDate",
                "localizedName": {
                    "en": "Start Date",
                    "de": "Startdatum"
                },
                "shortHelp": {
                    "en": "Start date of the key result",
                    "de": "Startdatum des Schl\u00fcsselergebnisses"
                },
                "constraint": {
                    "attributeType": "date",
                    "specificity": "DAY",
                    "dateFormat": "DAY_YEAR_LONG"
                },
                "multiplicity": "exactlyOne"
            },
            {
                "internalName": "cf.cplace.keyResult.endDate",
                "localizedName": {
                    "en": "End Date",
                    "de": "Enddatum"
                },
                "shortHelp": {
                    "en": "End date of the key result",
                    "de": "Enddatum des Schl\u00fcsselergebnisses"
                },
                "constraint": {
                    "attributeType": "date",
                    "specificity": "DAY",
                    "dateFormat": "DAY_YEAR_LONG"
                },
                "multiplicity": "exactlyOne"
            }
        ]
    }
]